{
  "schemaVersion": 1,
  "kind": "full",
  "planCommit": "8cc914c0ea575ae675d4067e27754b86f4e9171b",
  "toolchainCommit": "PENDING-F0",
  "environmentLockHash": "ec7bdf8a3b31112d6fa6f1b8ffcc5497f408de2f44ce3311d00b44825fc3426b",
  "aaCalibrationHash": "PENDING-F0",
  "aaPrimeHash": "PENDING-F0",
  "manifestHash": "PENDING-F0",
  "skipBaselineHash": "PENDING-F0",
  "policyHashes": {
    "environment-lock.json": "ec7bdf8a3b31112d6fa6f1b8ffcc5497f408de2f44ce3311d00b44825fc3426b",
    "baseline.json": "a65ff909637b46fe78f9494196ab065ae09c2c9c89330aa4ab3334e68fe1793c",
    "probe-policy.json": "0aa708ac0600263f3083ea26e8366f48615e30aa3d020256237c1827dc3b91d2",
    "mutation-spec.json": "e421248d4f088aeafec4f4a0f435d85f4188aab44e6a1f07423aca5ea35cba44",
    "path-classification.json": "412cc9624334bcbe3a3ef655ab2a082efbb42ad78125d15671f67db1dc464c19",
    "census-merge-policy.json": "31c6cc3e419fa6361cef67925295654a1ce1a7bf2d631904bbfdbeb547f000a3",
    "generated-paths-policy.json": "8428632a394c11ddf537c5d96dcfadcfd4228d2bda745b9f348b41f570ed2827",
    "g0-derivation-policy.json": "57ee52a029f880d0159fb5306e7b2f7a35224a34d856ea497064bb3328a20c0c",
    "design-ownership.json": "9129c39fd1e4367a3cc7fd7e1cc6f342facbf45a928b934842853df4c5746114",
    "reference-locale-capabilities.json": "2cf9ff7b6f2c741bb818cb08b2a4369ecdb1862a00f2f2134d631d2607e77394",
    "path-classification-coverage.json": "3b0b65361044fc6e2d426d1fffa1c34ce9c0ba23a486f3dad97455046eafdeca",
    "branch-policy-snapshot.json": "ccfec9cc588501ba69fbb476c819bf40c41269d5b021076c5dc5622cfe0e8b5d",
    "execution-budget.json": "42538061d6bd5a70c86fc19721026b8ece5a47453d376928c5212a2d576b0178",
    "state-policy.json": "6a8786d9a67969efe3ff2fd8a9e42cee29ccd590b2d069fe4a7f1c2d0dd7b14c",
    "motion-policy.json": "79a0af0caf39e28408a3f91da1e03db0cd72e5c53f57e44a733c1bffbc13f62d",
    "style-profiles.json": "d1ed653e6db529ef659746f73bd2205658917e3138ec9293d39a9ec6dc7cbf7e"
  },
  "schemaHashes": {
    "environment-lock.schema.json": "0d1b234443bbb3d6fe6b7d471cd9345d000fdb81f01bbeaa93c80eadf0448167",
    "baseline.schema.json": "1e701ef369833989c41c577c0927bdaca063fa4ae94556113cf8e8b4d330ad59",
    "probe-policy.schema.json": "1361869da0931dd0ca4591661d37d6a5c2799b82311338524b10d572138f826e",
    "mutation-spec.schema.json": "98b9a0841d9c1766c894ef1108a8f2896ae19c1ed72fac3dd518ea45e89b86b7",
    "path-classification.schema.json": "67c66d3e1c5a94c3a5609ec0d8f09caf71904e79cc1528d2855015f8334aff98",
    "census-merge-policy.schema.json": "0dedf14f42933b029c6793bcfb8ce130aadd89fb003563058b1aa33bce6c376e",
    "generated-paths-policy.schema.json": "64a16b26a79494e40dc22e370a93e6470fc882c438a68cbb90188285dac48c7b",
    "g0-derivation-policy.schema.json": "12274247b0728debd865211951f6500894e14bf57b6ed768aed5aacec2313b27",
    "design-ownership.schema.json": "9d0cf544247ecab3bf01d414e206f86722a031d71d8b8152c76388a40d008a1c",
    "reference-locale-capabilities.schema.json": "66f2cd72e4c22561fbd1fe4ccb1deada789cfc31d24ff74b3b033e08f58af29b",
    "path-classification-coverage.schema.json": "6cb465014a3df08c09be1ddde057ff83d3f33db46427420e01a4c663ddff9abb",
    "branch-policy-snapshot.schema.json": "a1a47ee4180fe877a6b14e1c097b3566f29d96707bfbd5e5deb101d8dea247f9",
    "execution-budget.schema.json": "e94051f497b84aa3930aa0c8900053e75e86f8ac958a6978fdc44a983153dd9c",
    "e2e-skip-baseline.schema.json": "85f26a81dbd364880ffa717e2909f52ce308d594adb1dbc17b1c711d75815550",
    "parity-run.schema.json": "4c71c0ffb656cd419b5beec00af2dec1ce7d454f078347c4bd012a87a85f5f83",
    "parity-result.schema.json": "7251de86d900255a79b931982c7e588274361c98a4d5af40991bb8eade995a51",
    "contract-lock.schema.json": "58f5f62c64853fa4b3ef89b55ada5e6e8875e9ccc7a0e23f20428d6a13dff21a",
    "aa-calibration.schema.json": "3d3dfad83a8fb85d6c9b6c1f699e5c3876dc0b6f524472670e5bfbfe227af093",
    "manifest.schema.json": "7e3fd21d3f595fe9844cd65daec6e0fade055f964f2b392ba6c4fd51c2328b93",
    "state-policy.schema.json": "c27a777c280463237540287d60eeb45f5ac43ac5663a18e78f97c2c9f5b265bc",
    "motion-policy.schema.json": "a59b14416c993e9ee99bb48467aedd27a465a6b474a8604b1714ae0b1828fea7",
    "style-profiles.schema.json": "4ba735a02bc5d008acd44c92bce89526b7866360fd7388c6403f47a2347b473c",
    "mask-policy.schema.json": "af742ac9f11a877f06e0cb4ffd544e7a5e0f837b52586036dcc8838398e37d55"
  },
  "viewportCatalog": [
    "desktop-wide",
    "desktop-compact",
    "tablet-portrait",
    "phone-portrait",
    "compact-landscape"
  ],
  "localeCatalog": [
    "fr-FR/ltr",
    "de-DE/ltr",
    "ar/rtl"
  ],
  "timelineCatalog": [
    "tab-switch-220ms",
    "panel-open-240ms",
    "message-insert-180ms",
    "composer-focus-120ms",
    "diff-insert-160ms",
    "graph-fit-360ms",
    "studio-pan-540ms",
    "dialog-open-180ms",
    "view-switch-220ms",
    "terminal-cursor-1s"
  ],
  "fontSet": [],
  "mutationSpecHash": "e421248d4f088aeafec4f4a0f435d85f4188aab44e6a1f07423aca5ea35cba44",
  "censusMergePolicyHash": "31c6cc3e419fa6361cef67925295654a1ce1a7bf2d631904bbfdbeb547f000a3",
  "pathClassificationHash": "412cc9624334bcbe3a3ef655ab2a082efbb42ad78125d15671f67db1dc464c19",
  "createdAt": "2026-09-18T00:00:00Z",
  "notes": [
    "Lock-only commit per the consolidated plan §59 (QF0 full qualification lock). The full lock can only become qualifying after F0 lands the Docker image + A/A calibration; until then, every PENDING-F0 field stays as the F0 requalification gap.",
    "Unlike the pilot lock (parity/pilot-contract-lock.json which fills the hashes that exist on the host), the full lock intentionally stays entirely PENDING-F0 because the F0 toolchain commit is a Docker image digest that only F0 can compute. Lock-only discipline per §22 and §31.",
    "When F0 lands: parity:lock:refresh (added in L0-refresh) will be extended to fill the QF0 fields too, or a new parity:lock:full-refresh will be added. Until then, G0 stays G0_BOOTSTRAP per g0-derivation-policy.json."
  ]
}
